statement,category,estimated_iq,iq_estimate,response
"The education system needs significant reform to better prepare students for the modern workforce. Many schools still focus on memorization rather than critical thinking skills. While basic knowledge is important, students also need to learn how to solve problems and work in teams. A balanced approach would better serve both students and future employers.",average,95,115.0,"I'm not an expert in IQ assessment, and IQ can't be accurately determined from a short piece of writing alone. IQ is a measure of cognitive abilities, typically assessed through standardized tests, and it encompasses a range of skills including problem-solving, reasoning, and comprehension. However, I can make an educated guess based on the clarity, structure, and content of your writing.

Your writing demonstrates clear communication, logical flow, and an awareness of the need for educational reform with a focus on critical thinking and teamwork. These traits suggest above-average verbal and analytical skills. The average IQ is typically considered to be 100, with a standard deviation of 15 in most scales. Given the quality of your writing, I would estimate your IQ to be modestly above average.

Thus, my guess is \boxed{115}. Please note that this is purely speculative and not based on a formal assessment."
"As I walked through the ancient ruins, I couldn't help but imagine what life was like centuries ago. The crumbling stone walls told stories of past civilizations, while the intricate carvings hinted at their artistic achievements. The warm Mediterranean sun beat down as I explored each corner, feeling a deep connection to history.",average,105,110.0,"Estimating IQ based on a short piece of writing is highly speculative and not scientifically valid, as IQ is a measure of cognitive abilities that cannot be accurately determined from a few sentences. However, since you've asked for a guess within the context of this exercise, I’ll base my estimation on the clarity, vocabulary, and imagination displayed in your writing.

Your passage demonstrates a decent command of language, with descriptive phrases like ""crumbling stone walls,"" ""intricate carvings,"" and ""deep connection to history."" The writing also shows an ability to visualize and reflect on the past, which suggests creativity and empathy. The structure is coherent, and the tone is evocative, though not exceptionally complex or advanced in terms of syntax or vocabulary. It appears to be the work of someone with average to above-average verbal and imaginative skills.

Given that the average IQ is around 100, and considering the writing reflects a thoughtful but not extraordinarily sophisticated style, I would estimate an IQ in the slightly above-average range. I’ll guess 110, acknowledging the inherent limitations of this exercise.

\[ \boxed{110} \]"
"The rise of artificial intelligence presents both opportunities and challenges for society. AI can improve efficiency in many industries and help solve complex problems. However, it also raises concerns about job displacement and privacy. We need careful regulation to ensure AI development benefits everyone while minimizing potential harm.",average,100,115.0,"Estimating someone's IQ based on a short piece of writing is highly speculative and not scientifically valid, as IQ is influenced by a wide range of factors beyond writing ability, such as problem-solving skills, emotional intelligence, and other cognitive abilities not evident in text. Additionally, writing reflects education, vocabulary, and clarity of thought rather than a direct measure of intelligence.

That said, your writing is clear, concise, and demonstrates an ability to articulate a balanced perspective on a complex topic (AI's opportunities and challenges). It shows critical thinking and logical structure, which are often associated with above-average cognitive ability. The language is straightforward yet effective, suggesting competence in communication.

Given the limitations of this exercise and basing my guess solely on the content and style of this short excerpt, I would estimate an IQ in the range of above average, around 110-120, which reflects strong comprehension and expression skills. I'll settle on 115 as a reasonable guess within the requested range of 0 to 200.

\[ \boxed{115} \]"
"My experience volunteering at the animal shelter taught me valuable lessons about compassion and responsibility. Each animal had its own personality and needs, requiring different approaches to care. The work was often challenging, but seeing a previously neglected pet find a loving home made it all worthwhile.",average,95,105.0,"It's not possible to accurately determine someone's IQ based solely on a short piece of writing like this. IQ (Intelligence Quotient) is a measure of cognitive abilities, including problem-solving, reasoning, and memory, which cannot be directly assessed through a brief personal reflection. Your writing demonstrates clarity, empathy, and the ability to articulate thoughts, but these qualities don't directly correlate with a specific IQ score.

Since you've asked for a numerical guess within the range of 0 to 200, and considering that the average IQ is around 100, I'll provide a speculative estimate based on the general competency shown in your writing. This is purely a guess and should not be taken as a serious assessment of your intelligence.

\[
\boxed{105}
\]"
"The debate over healthcare reform continues to divide the nation. While universal healthcare would ensure access for all citizens, it could lead to higher taxes and longer wait times. Private healthcare offers more choices but leaves many without coverage. A hybrid system might provide the best balance of accessibility and quality.",average,105,115.0,"Estimating someone's IQ based on a short piece of writing is highly speculative and not scientifically reliable, as IQ is a complex measure of cognitive abilities that cannot be accurately assessed from a single paragraph. However, since you've requested a guess, I’ll base it on the clarity, structure, and critical thinking evident in your writing.

Your paragraph on healthcare reform demonstrates coherent thought, a balanced perspective, and the ability to weigh pros and cons of different systems. The writing is concise, uses appropriate vocabulary, and suggests an understanding of a complex social issue. These qualities align with above-average verbal and analytical skills, which are components of IQ.

Given this, I would estimate your IQ to be around 115, which is above the average of 100 and reflects strong reasoning and communication skills, while acknowledging that this is purely a subjective guess based on limited information.

\[ \boxed{115} \]"
"The first time I traveled abroad alone, I was both excited and nervous. Navigating unfamiliar airports and communicating in a different language was challenging. However, these experiences helped me grow more confident and independent. I learned to appreciate different cultures and adapt to new situations.",average,100,105.0,"Estimating IQ based on a short piece of writing is highly speculative and not scientifically valid, as IQ is a complex measure of cognitive abilities that cannot be accurately determined from a brief text sample. However, since you've asked for a guess within the given constraints, I’ll base it on the clarity, coherence, and introspection shown in your writing.

Your passage demonstrates a clear narrative structure, grammatical correctness, and a reflective tone, suggesting average to above-average verbal and emotional intelligence. The content does not exhibit exceptional complexity or advanced vocabulary that might suggest a very high IQ, nor does it show significant deficits that might suggest a lower IQ. Therefore, I would estimate an IQ in the average to slightly above-average range, which is typically around 100 to 110.

I’ll settle on a guess of 105, acknowledging the inherent limitations of such an estimation.

\[ \boxed{105} \]"
"Climate change is one of the most pressing issues facing our generation. Rising temperatures and extreme weather events are already affecting communities worldwide. While individual actions like recycling help, we need stronger government policies and international cooperation to make a real difference.",average,95,110.0,"It's challenging to accurately estimate someone's IQ based on a short piece of writing, as IQ is a complex measure of cognitive abilities that cannot be fully assessed through text alone. However, I can make an educated guess based on the clarity, structure, and content of your writing.

Your writing demonstrates an awareness of a significant global issue (climate change), presents a clear opinion, and acknowledges both individual and systemic solutions. The language is straightforward, coherent, and suggests an ability to think critically about societal challenges. This level of articulation and reasoning is consistent with above-average intelligence.

I would estimate your IQ to be around 110, which is slightly above the average of 100 and reflects the ability to express ideas clearly and engage with complex topics.

\[\boxed{110}\]"
"My grandfather's workshop was a place of wonder and creativity. The smell of sawdust and the sound of tools filled the air as he crafted beautiful furniture. He taught me the value of patience and attention to detail, lessons that have stayed with me throughout my life.",average,105,100.0,"It is not possible to accurately estimate someone's IQ based on a short piece of writing alone, as IQ is a complex measure of cognitive abilities that cannot be determined from a single sample of text. Writing reflects a combination of learned skills, personal experiences, and creativity, rather than a direct indication of intelligence as measured by IQ.

However, since you've requested a guess within the specified format, I’ll note that the writing demonstrates clarity, emotional insight, and a reflective tone, which suggest an ability to express thoughts effectively. As a purely arbitrary guess, and without any scientific basis, I’ll propose an IQ of 100, which represents the average intelligence quotient.

\[
\boxed{100}
\]"
"The increasing popularity of remote work has changed how companies operate. Employees enjoy more flexibility and better work-life balance, but some struggle with isolation and maintaining productivity. Companies must find ways to support their remote workforce while maintaining company culture and collaboration.",average,100,115.0,"It's important to note that IQ cannot be accurately determined from a short piece of writing alone, as it is influenced by a wide range of cognitive abilities, problem-solving skills, and other factors not evident in a brief text. However, since you've asked for a guess based on this writing, I’ll provide an estimate based on the clarity, structure, and content of your paragraph.

Your writing demonstrates clear communication, logical organization, and an understanding of the topic (remote work's impact on companies and employees). The sentence structure is coherent, and the ideas are presented concisely, reflecting an above-average ability to articulate thoughts effectively. There are no glaring grammatical errors or stylistic issues, which suggests competence in written expression.

Given that the average IQ is typically around 100, and considering that effective written communication often correlates with slightly above-average intelligence, I would estimate your IQ to be in the range of 110–120. I'll settle on 115 as a reasonable guess, acknowledging the limitations of such an assessment.

\[ \boxed{115} \]"
"Growing up in a small town had its advantages and disadvantages. Everyone knew each other, creating a strong sense of community, but there were limited opportunities for entertainment and career growth. Moving to the city was a big adjustment, but it opened doors to new experiences and possibilities.",average,95,110.0,"Estimating someone's IQ based on a short piece of writing is highly speculative and not scientifically valid, as IQ is a complex measure of cognitive abilities that cannot be accurately inferred from a brief text. However, since you've requested a guess within the specified format, I’ll base my estimation on the clarity, structure, and coherence of your writing, which are indirectly related to verbal intelligence—a component of IQ.

Your writing is concise, grammatically correct, and effectively communicates a personal experience with a balanced perspective on small-town and city life. It demonstrates reflective thinking and an ability to articulate ideas clearly, which suggests above-average verbal skills. The average IQ is typically set at 100, with a standard deviation of 15 in most scales (like the Wechsler scale). Writing of this quality might place you somewhat above average, but without more data, I’ll make a conservative guess.

I’ll estimate your IQ to be around 110, which is slightly above average and reflective of good verbal and reasoning skills.

\[ \boxed{110} \]"
"The debate over social media's impact on mental health is ongoing. While it helps people stay connected, excessive use can lead to anxiety and depression. Setting boundaries and taking regular breaks from social media can help maintain a healthy balance between online and offline life.",average,105,105.0,"Estimating IQ based on a short piece of writing is highly speculative and not scientifically valid, as IQ is a complex measure of cognitive abilities that cannot be accurately determined from a few sentences. However, since you've requested a guess within the given framework, I'll base my estimation on the clarity, coherence, and basic understanding demonstrated in your writing.

Your text shows a clear structure, with a concise statement about the debate on social media's impact on mental health, acknowledgment of both positive and negative aspects, and a practical suggestion for balance. The language is straightforward and accessible, reflecting an average to above-average ability to articulate thoughts.

Given this, I would estimate an IQ in the range of average to slightly above average for the general population. The average IQ is typically set at 100, with a standard deviation of 15 in most scales. I’ll guess around 105, reflecting a reasonable but not exceptional level of verbal and analytical ability inferred from the writing.

\[ \boxed{105} \]"
"My first attempt at gardening was a learning experience. I carefully researched different plants and their needs, but still made mistakes along the way. Some plants thrived while others struggled, teaching me about the importance of proper care and patience. Now my garden is a source of pride and relaxation.",average,100,110.0,"Based on the writing sample provided, I would estimate your IQ to be around 110. This guess is based on the clarity and coherence of your writing, which suggests above-average intelligence, as well as the reflective nature of your content, indicating self-awareness and learning ability. However, IQ is a complex measure that cannot be accurately determined from a short piece of writing alone; this is purely a speculative estimate based on limited information.

\[ \boxed{110} \]"
"The future of transportation is evolving rapidly with the development of electric and autonomous vehicles. These technologies promise to reduce emissions and improve safety, but they also raise questions about infrastructure and job displacement. Careful planning and investment will be crucial for a smooth transition.",average,95,115.0,"Estimating someone's IQ based on a short piece of writing is highly speculative and not scientifically valid, as IQ is a complex measure of cognitive abilities that cannot be accurately assessed from a single text sample. However, since you've asked for a guess within the given constraints, I’ll base my estimate on the clarity, coherence, and critical thinking displayed in your writing.

Your text demonstrates clear communication, an understanding of a contemporary issue (electric and autonomous vehicles), and an awareness of both benefits and challenges, indicating analytical thinking. The writing style suggests at least average verbal and reasoning skills, likely placing you within or above the average IQ range of 90-110.

Since your writing is concise and insightful, I’ll estimate slightly above average. My guess is \boxed{115}. Please note that this is purely a subjective estimate and not a reliable measure of your actual IQ."
"The small bookstore in my neighborhood is more than just a place to buy books. It's a community hub where people gather for readings and discussions. The owner knows each customer's preferences and can recommend the perfect book. In an age of online shopping, places like this remind us of the value of local businesses.",average,105,110.0,"I'm not a psychologist or an expert in IQ assessment, and IQ cannot be accurately determined from a short piece of writing alone. IQ tests measure a range of cognitive abilities through structured assessments, not casual text. However, since you've asked for a guess within the given format, I'll base it on the clarity, coherence, and thoughtfulness of your writing. Your text demonstrates a good command of language, an ability to convey a meaningful idea, and an appreciation for community values, which suggests at least average to above-average verbal and emotional intelligence.

As a rough guess, I’ll estimate an IQ of 110, which is slightly above the average of 100, reflecting the competence and insight in your writing.

\[ \boxed{110} \]"
"The debate over standardized testing in schools continues to spark controversy. While tests provide measurable data about student performance, they don't capture creativity or critical thinking skills. Alternative assessment methods might better reflect a student's true abilities and potential.",average,100,115.0,"Estimating IQ based on a short piece of writing is highly speculative and not scientifically valid, as IQ is a complex measure of cognitive abilities that cannot be accurately inferred from a brief text. However, since you've requested a guess within the constraints of the question, I will base my estimate on the clarity, coherence, and critical perspective demonstrated in your writing.

Your text shows an ability to articulate a balanced view on a debated topic, acknowledge the limitations of standardized testing, and suggest alternative approaches. This indicates analytical thinking and effective communication skills, which are often associated with above-average intelligence.

Considering the general population's IQ distribution (mean of 100, standard deviation of 15), I would place you in the above-average range. I'll guess an IQ of 115, which is roughly in the top 16% of the population, reflecting competence in expressing nuanced ideas.

\[ \boxed{115} \]"
"My experience learning to play the piano taught me about perseverance and discipline. The early days were frustrating, with clumsy fingers and wrong notes. But with regular practice and guidance from my teacher, I gradually improved. Music has become an important part of my life and a source of joy.",average,95,105.0,"Based on the writing sample provided, it is challenging to make a precise estimate of IQ as it reflects only a small aspect of cognitive ability—specifically, written expression. IQ is a complex measure that encompasses various domains such as logical reasoning, problem-solving, verbal comprehension, and more, which cannot be fully assessed from a short paragraph.

However, for the sake of this exercise, I can make a general observation. The writing demonstrates clarity, coherence, and an ability to convey a personal experience with simplicity and structure. These traits suggest average to above-average verbal skills. Assuming other cognitive abilities align similarly, a rough estimate within the average range seems reasonable. The average IQ is statistically defined as 100, so I will center my guess around this value.

Therefore, I would guess an IQ of \boxed{105}."
"The rise of streaming services has transformed how we consume entertainment. While convenient and affordable, it has also led to the decline of traditional movie theaters and cable TV. The entertainment industry must adapt to these changes while preserving the unique experiences they offer.",average,105,105.0,"I’ll approach this with a bit of humor and humility since guessing someone's IQ based on a short piece of writing is, at best, speculative and not grounded in any scientific method. IQ, or Intelligence Quotient, is a measure of cognitive abilities, typically assessed through standardized tests, not casual writing samples. Factors like vocabulary, grammar, clarity, and complexity of thought can hint at verbal intelligence, but they’re far from definitive indicators.

Your writing is concise, coherent, and tackles a contemporary topic—the impact of streaming services on entertainment. The ideas are straightforward, showing an awareness of cultural trends and a balanced perspective (""convenient and affordable"" versus ""decline of traditional movie theaters""). The sentence structure is clear, with no glaring errors, and the tone is reflective. It suggests a decent level of critical thinking and communication skills, which often correlate with average to above-average intelligence. However, there’s no exceptional complexity, unique insight, or advanced vocabulary that might suggest outlier intellectual ability—nor is there anything simplistic or poorly constructed that would imply the opposite.

Given the general population IQ average of around 100 (with a standard deviation of 15 in most scales), and considering your writing falls into a competent but not extraordinary range, I’ll estimate an IQ of 105. This is a slight bump above average to account for the clarity and relevance of the topic, but still within a typical range, as the sample doesn’t provide evidence for exceptional cognitive depth or creativity.

So, my guess is \boxed{105}. Please note this is purely a speculative exercise and shouldn’t be taken as a serious assessment of your intelligence! If you’re curious about your actual IQ, a formal test from a qualified professional would be the way to go."
Volunteering at the community center has given me a new perspective on my neighborhood. I've met people from different backgrounds and learned about their challenges and aspirations. This experience has made me more empathetic and motivated to contribute to my community.,average,100,105.0,"Estimating someone's IQ based solely on a short piece of writing is inherently speculative and imprecise, as IQ is a complex measure of cognitive abilities that cannot be accurately determined from a few sentences. However, I can make an educated guess based on the clarity, coherence, and emotional insight in your writing.

Your text demonstrates clear communication, self-reflection, and empathy, which suggest a decent level of verbal intelligence and emotional awareness. The structure and grammar are correct, and the ideas flow logically. These traits are often associated with average to above-average intelligence.

Given the lack of additional context or challenges in the writing (e.g., advanced vocabulary, complex reasoning, or abstract thought), I would estimate your IQ to be around 105, which is slightly above the population average of 100.

\[ \boxed{105} \]"
"The debate over privacy in the digital age raises important questions about security and freedom. While data collection can improve services and prevent crime, it also risks violating personal privacy. Finding the right balance between security and individual rights is crucial for our digital future.",average,95,115.0,"Assessing someone's IQ based solely on a short piece of writing is highly speculative and not grounded in any reliable methodology. IQ, or Intelligence Quotient, measures a range of cognitive abilities and is typically determined through standardized tests, not through brief text samples. However, since you’ve requested a guess within the given constraints, I’ll base my estimation on the clarity, coherence, and critical thinking evident in your writing.

Your paragraph demonstrates an ability to articulate a balanced perspective on a complex issue—privacy in the digital age. You present both sides of the debate (security versus personal freedom) and emphasize the importance of finding a balance, which suggests analytical thinking and awareness of nuance. The writing is concise and grammatically correct, indicating a reasonable level of verbal intelligence.

Given that the average IQ is around 100, and considering that your writing reflects above-average clarity and reasoning for a general audience, I would estimate your IQ to be in the range of someone with solid critical thinking skills, likely higher than average but not necessarily in the exceptional range without further evidence.

Thus, my guess is \boxed{115}."
