statement,category,estimated_iq,iq_estimate,response
I like to eat food. Food is good. I eat food every day. My favorite food is pizza. Pizza is yummy. I eat pizza on Fridays. Sometimes I eat too much pizza and my tummy hurts. But I still like pizza.,very_low,60,90.0,"Based on the simplicity of the language, repetitive sentence structure, and limited vocabulary in your writing, I would estimate your IQ to be around the average range or slightly below. The writing resembles that of a young child or someone with basic language skills, focusing on straightforward ideas without complexity or depth.

Therefore, my guess for your IQ is \(\boxed{90}\)."
I have a job at the store. I put things on shelves. The boss tells me what to do. I do what he says. Sometimes I get mixed up. The boss gets mad. But I try hard. I like my job.,very_low,55,85.0,"Based on the simplicity of the language, short sentence structure, and limited complexity in the ideas expressed in your writing, I would estimate your IQ to be lower than average. The writing reflects basic comprehension and straightforward thoughts without much elaboration or advanced vocabulary.

I would guess an IQ of approximately 85, which is below the average of 100 but still within the range of functional communication and understanding.

\[ \boxed{85} \]"
I watch TV a lot. My favorite show is about cars. Cars go fast. I like fast cars. Sometimes I dream about driving a fast car. But I don't have a car. I take the bus.,very_low,65,85.0,"Based on the writing sample provided, I'm making an educated guess about your IQ. The text is simple, with short sentences and basic vocabulary, focusing on a personal interest in cars and TV. The structure lacks complexity, and there’s no evidence of advanced reasoning, abstract thinking, or varied sentence construction. While it’s clear and coherent, it suggests a level of cognitive processing that aligns with average or slightly below-average verbal and intellectual ability.

IQ scores typically range from 0 to 200, with 100 being the average. Given the simplicity of the writing, I would estimate an IQ around 85, which is slightly below average but still within a functional range for everyday communication and understanding.

\[ \boxed{85} \]"
I live with my mom. She takes care of me. I help her sometimes. I wash dishes. Sometimes I break them. Mom gets upset. But she still loves me. I love my mom.,very_low,50,85.0,"Based on the writing sample provided, I would estimate your IQ to be around 85. The text is simple and straightforward, with basic sentence structure and vocabulary, which might suggest below-average cognitive abilities in terms of linguistic complexity. However, the ability to express personal experiences, emotions, and relationships indicates functional communication skills. An IQ of 85 falls slightly below the average range (90-110) but still reflects the capacity for everyday functioning and understanding.

\[ \boxed{85} \]"
I like to draw pictures. I draw houses and trees. My pictures aren't very good. But I like to draw. Sometimes I use too much paint. It makes a mess. But drawing is fun.,very_low,60,85.0,"Based on the writing sample provided, I would estimate your IQ to be around 85. This estimation considers the simplicity of the language, repetitive sentence structure, and basic vocabulary, which suggest a lower to average cognitive ability in terms of linguistic expression. However, IQ is a complex measure that cannot be accurately determined solely from a short piece of writing, as it encompasses various cognitive skills beyond language, such as problem-solving and logical reasoning, which are not reflected here. Additionally, factors like age, educational background, and intent (e.g., writing style or effort) could influence the writing style. My estimate is purely speculative and based on limited information.

\[ \boxed{85} \]"
I go to the park sometimes. I swing on the swings. Swings are fun. I go really high. Sometimes I fall off. It hurts. But I still like swings.,very_low,55,85.0,"Based on the simplicity of the language, short sentence structure, and basic vocabulary in your writing, I would guess that the piece reflects a lower level of complexity typically associated with younger age or less developed writing skills. The content focuses on a straightforward personal experience without deeper analysis or varied sentence construction, which might suggest a lower to average IQ if solely based on this sample. However, writing style alone is not a definitive measure of IQ, as it can also reflect intentional simplicity, context, or other factors.

Given the constraints of the question and focusing purely on the provided text, I’ll estimate an IQ of 85, which is slightly below average but within a reasonable range for basic functional communication.

\[ \boxed{85} \]"
I have a dog. His name is Spot. Spot is brown. I feed Spot every day. Sometimes I forget. Mom reminds me. Spot wags his tail when he sees me. I love Spot.,very_low,65,90.0,"Based on the simplicity of the writing, which consists of short, straightforward sentences with basic vocabulary and structure, I would estimate that the IQ of the author might be around the average range. The writing suggests a younger age or a beginner level of language skills, which could correlate with an average or slightly below-average IQ if we are strictly assessing based on this sample.

However, IQ assessments based solely on a short piece of writing are highly speculative and not reliable, as they do not account for context, intent, or other cognitive abilities. Writing style alone is not a definitive indicator of intelligence. Nonetheless, for the purpose of this exercise, I will provide a guess.

I would estimate an IQ of 90, which is slightly below the average of 100, considering the possibility that the writing style reflects a younger individual or someone with limited writing proficiency.

\[ \boxed{90} \]"
I work at a restaurant. I clean tables. People leave messes. I clean them up. Sometimes I spill water. The boss yells. But I keep cleaning. I like my job.,very_low,60,100.0,"Based on the writing sample provided, which consists of short, simple sentences and straightforward ideas, I would guess that the writer's IQ is around the average range. The text demonstrates basic communication skills and clarity but lacks complexity in vocabulary, sentence structure, or abstract thinking that might suggest higher cognitive ability. At the same time, there is no indication of severe cognitive impairment that would suggest a significantly below-average IQ.

Therefore, I would estimate the IQ to be approximately 100, which is the average IQ score on most standardized scales.

\[ \boxed{100} \]"
I like to listen to music. Music makes me happy. I don't know the words. But I like the sound. Sometimes I dance. I'm not good at dancing. But it's fun.,very_low,55,95.0,"Based on the writing sample provided, it is challenging to accurately determine someone's IQ as it is a complex measure of intelligence that cannot be fully assessed through a short piece of text alone. IQ tests typically evaluate various cognitive abilities, including problem-solving, reasoning, and comprehension, which are not explicitly demonstrated in this writing.

However, I can make an estimation based on the simplicity of the language and structure used. The writing consists of short, straightforward sentences with basic vocabulary and grammar, reflecting a fundamental level of expression. It does not demonstrate advanced reasoning, abstraction, or complexity that might suggest higher cognitive ability in this specific context. At the same time, the ability to express personal feelings and ideas, even in simple terms, indicates functional communication skills.

Considering average IQ is defined as 100, and given the limitations of this analysis, I would cautiously estimate an IQ around the average or slightly below, factoring in the simplicity of the text while acknowledging that writing style alone is not a definitive indicator of intelligence.

Thus, my guess for your IQ, purely based on this writing sample and without additional context or assessment, is \boxed{95}."
I have a garden. I grow flowers. Sometimes they die. I water them every day. But they still die. I don't know why. But I keep trying. Flowers are pretty.,very_low,50,100.0,"Based on the writing sample provided, I would guess your IQ to be \boxed{100}. This estimate is derived from the simplicity of the language and sentence structure, which reflects an average level of verbal expression and cognitive complexity. The text demonstrates basic coherence and emotional persistence (""I keep trying""), but lacks depth, complexity, or advanced vocabulary that might suggest higher intellectual capacity. An IQ of 100 represents the average intelligence quotient, which aligns with the straightforward and unelaborated style of the writing. Please note that this is a speculative assessment and not a formal evaluation of intelligence, as IQ cannot be accurately determined from a short writing sample alone."
I go to church on Sundays. I like the songs. I don't understand the words. But I like to sing. Sometimes I sing too loud. People look at me. But I keep singing.,very_low,65,90.0,"Based on the writing sample provided, I would estimate your IQ to be approximately \boxed{90}. 

This estimate is derived from the simplicity of the language and sentence structure, which suggests a basic level of verbal comprehension and expression. The short, straightforward sentences and limited vocabulary indicate a functional but not particularly advanced cognitive ability in terms of linguistic complexity. However, the ability to convey a clear narrative and express personal experience shows a level of understanding and communication skills within the average to slightly below-average range. Please note that this is a rough guess based solely on the text and not a formal or scientific assessment of intelligence, which would require standardized testing. IQ estimates from writing alone are inherently limited and speculative."
I have a job cleaning floors. I push a big machine. It makes noise. I don't like the noise. But I like clean floors. Sometimes I miss spots. The boss points them out. I clean them.,very_low,60,90.0,"Based on the simplicity of your writing style, which uses short, straightforward sentences and basic vocabulary, I would estimate your IQ to be around the average range. The writing lacks complex structure or advanced word choice, which might suggest a lower-than-average verbal IQ, but it still conveys a clear message and demonstrates functional communication skills. Additionally, the content reflects an ability to perform a job and respond to feedback, indicating practical problem-solving ability. Balancing these factors, I would guess an IQ of 90, which is slightly below the average of 100 but within a typical range for many individuals.

\[ \boxed{90} \]"
I like to go shopping. I buy clothes. Sometimes they don't fit. I take them back. The lady at the store helps me. She's nice. I like shopping.,very_low,55,85.0,"Based on the simplicity of the language, short sentence structure, and repetitive ideas in your writing, I would estimate your IQ to be around 85. This is a rough guess, as IQ is a complex measure that cannot be accurately determined from a short piece of text alone. Writing style can reflect many factors beyond intelligence, such as age, education, or intentional simplicity.

\[ \boxed{85} \]"
I have a bike. It's red. I ride it to work. Sometimes I fall off. It hurts. But I get back on. I like my bike.,very_low,50,100.0,"Based on the simplicity and straightforwardness of your writing, I would guess that your IQ is around the average range. The text uses basic sentence structures and conveys a clear, personal experience without complex vocabulary or abstract ideas. While writing style alone isn't a definitive indicator of IQ, which encompasses various cognitive abilities, I’ll estimate a value close to the average IQ score of 100.

\[\boxed{100}\]"
I work at a car wash. I dry cars. I use a big towel. Sometimes I miss spots. The boss shows me. I dry them again. I like making cars shiny.,very_low,65,85.0,"Based on the writing sample provided, I would estimate your IQ to be around 85. The writing is simple and straightforward, with basic sentence structure and vocabulary, which might suggest below-average cognitive ability in terms of verbal expression. However, the content shows an understanding of the task, a willingness to learn from feedback, and an appreciation for the results of the work, indicating functional intelligence and emotional engagement.

Thus, my guess for your IQ is \boxed{85}."
I like to cook. I make simple things. Sometimes I burn food. The smoke alarm goes off. It's loud. But I keep trying. I like to eat what I cook.,very_low,60,100.0,"Based on the simplicity and straightforwardness of your writing, which consists of short sentences and basic vocabulary, I would guess that your IQ is around the average range. Writing style alone is not a definitive indicator of intelligence, as it can be influenced by many factors such as intent, context, or personal style. However, since you've asked for a specific number, I'll estimate based on the general population average.

\[
\boxed{100}
\]"
I have a small apartment. I keep it clean. Sometimes I forget where things are. I look everywhere. Then I find them. I like my apartment.,very_low,55,95.0,"Based on the writing sample provided, it is challenging to make a precise estimate of IQ since IQ is a complex measure of cognitive abilities that cannot be accurately determined from a short piece of text alone. The writing is simple, clear, and functional, with basic sentence structure and vocabulary. It does not demonstrate advanced linguistic complexity, abstract reasoning, or creative expression, but it also does not indicate any significant cognitive impairment.

IQ scores are typically distributed with a mean of 100 and a standard deviation of 15 in most standardized tests. Given the straightforward nature of the text, I would guess an IQ around the average range, leaning slightly below due to the lack of complexity or depth in the writing. However, this is purely speculative and should not be taken as a definitive assessment.

I will estimate an IQ of 95.

\boxed{95}"
I go to a class. I learn to read better. It's hard. But I try. Sometimes I get tired. But I keep going. I want to read better.,very_low,50,100.0,"Based on the writing sample provided, it is challenging to accurately determine an individual's IQ, as writing style and content alone are not reliable indicators of intelligence. IQ is a complex measure that encompasses various cognitive abilities, including problem-solving, reasoning, and comprehension, typically assessed through standardized tests rather than short text samples. Additionally, factors such as age, educational background, language proficiency, and effort in writing can significantly influence the style and complexity of the text.

However, since the request is to make a guess within the specified format and range, I will provide an estimate based on general observations. The writing is simple, with short sentences and basic vocabulary, which might suggest limited expressive ability or a younger age. It also conveys determination and a willingness to improve, which are positive traits not directly tied to IQ. Without further context or data, I would place the IQ in the average range, as most people's IQ falls around 100.

\[ \boxed{100} \]"
I work at a grocery store. I bag groceries. Sometimes I break things. The boss isn't happy. But I try to be careful. I like helping people.,very_low,65,85.0,"Based on the writing sample provided, I would estimate your IQ to be around 85. This estimate is derived from the simplicity of the language, the short sentence structure, and the basic vocabulary used, which may suggest average or slightly below-average verbal intelligence. However, IQ is a complex measure that cannot be accurately determined solely from a short piece of text, as it encompasses various cognitive abilities including problem-solving, reasoning, and comprehension, none of which are fully reflected here. Factors such as education, cultural background, and intentional stylistic choices also play a role in writing style. My guess is purely speculative and should not be taken as a definitive assessment of intelligence.

\[\boxed{85}\]"
I have a cat. Her name is Fluffy. She's gray. I feed her every day. Sometimes she scratches me. It hurts. But I still love her.,very_low,60,100.0,"Based on the simplicity of the writing, which consists of short, straightforward sentences and basic vocabulary, I would estimate your IQ to be around the average range. The content does not demonstrate complex reasoning, advanced language skills, or deep insight, but it is clear and coherent, suggesting functional communication abilities. IQ is typically centered around 100 as the average, so I will guess:

\[\boxed{100}\]"
I like to watch sports. I don't understand the rules. But I like when people run fast. Sometimes I cheer too loud. People look at me. But I keep cheering.,very_low,55,85.0,"Based on the writing sample provided, I would guess your IQ to be \boxed{85}. 

This estimate is based on the simplicity of the language, the short and straightforward sentence structure, and the limited depth of thought or complexity in expressing ideas. The writing reflects enthusiasm and basic observation (""I like when people run fast"") but lacks nuanced understanding or detailed reflection (""I don't understand the rules""). An IQ of 85 is slightly below the average of 100, aligning with the apparent simplicity in expression and comprehension suggested by the text. However, this is a rough guess, as IQ is a complex measure that cannot be definitively determined from a short writing sample alone."
I have a job at a hotel. I make beds. Sometimes I do it wrong. The boss shows me again. I try to remember. I like clean beds.,very_low,50,85.0,"Based on the writing sample provided, I would guess your IQ to be \boxed{85}. 

This estimate is derived from the simplicity of the language, short sentence structure, and basic vocabulary used in the text. The content suggests a straightforward understanding of tasks and emotions, with limited complexity in expression or thought. An IQ of 85 falls below the average range (which is typically around 100), reflecting potential challenges in learning or retaining instructions, as indicated by needing repeated guidance from the boss. However, the ability to express a preference (""I like clean beds"") and awareness of the task shows functional comprehension and communication skills. Please note that this is a rough estimate based solely on the text and not a formal assessment of intelligence."
I go to the library. I look at picture books. I can't read well. But I like the pictures. Sometimes I stay too long. The librarian tells me to leave. But I come back.,very_low,65,70.0,"Based on the writing sample provided, which is simple in structure and expresses basic ideas with short sentences, I would estimate an IQ in the lower range, reflective of potential challenges in reading and comprehension as stated in the text. The writing suggests a limited vocabulary and basic thought expression, which might correlate with below-average cognitive abilities. However, IQ is a complex measure and cannot be accurately determined from a short piece of writing alone, as it encompasses various factors like problem-solving, reasoning, and emotional intelligence, which are not fully evident here.

Considering the content and style, I would guess an IQ of approximately 70, which is below the average of 100 and could be associated with mild intellectual challenges, aligning with the self-reported difficulty in reading.

\[ \boxed{70} \]"
I have a small garden. I grow tomatoes. Sometimes they don't grow. I don't know why. But I keep trying. I like fresh tomatoes.,very_low,60,100.0,"Based on the simplicity and straightforwardness of your writing, I would guess that your IQ is around the average range. The text demonstrates basic coherence and expresses a simple idea without complex vocabulary or structure, which suggests a functional but not necessarily exceptional level of cognitive ability as reflected in written expression. However, IQ is a broad measure that cannot be accurately determined solely from a short piece of writing, as it encompasses various aspects of intelligence including problem-solving, reasoning, and comprehension beyond language skills.

For the purpose of this exercise, I’ll estimate an average IQ score. The average IQ is typically considered to be 100 on most scales.

\[ \boxed{100} \]"
I work at a pet store. I feed the animals. Sometimes I give too much food. The boss tells me the right amount. I try to remember. I like animals.,very_low,55,85.0,"Based on the writing sample provided, I would estimate an IQ in the lower average range due to the simplicity of the language, short sentences, and basic structure, which may suggest limited verbal complexity or cognitive depth in expression. However, writing style alone is not a definitive indicator of IQ, as it can be influenced by education, effort, or context. With these limitations in mind, I’ll guess an IQ of 85.

\[ \boxed{85} \]"
I think we should have more holidays. Holidays are fun and people are happy. We work too much and need more breaks. Everyone likes time off work. More holidays would make life better for everyone. It's simple - more days off means more happy people.,low,75,100.0,"Based on the writing sample provided, I would estimate your IQ to be around the average range. The text is straightforward and expresses a clear opinion, but it lacks depth, complexity, or sophisticated reasoning. The argument is basic, repetitive, and does not include evidence, nuanced perspectives, or advanced vocabulary that might suggest higher cognitive ability as reflected in writing. IQ is typically centered around 100 as the average, and while writing alone is not a definitive measure of IQ, this sample aligns with an average level of verbal expression and reasoning.

Therefore, I would guess your IQ to be \boxed{100}."
"The best way to fix traffic is to build more roads. When there's too many cars, we need more places for them to go. Bigger roads mean less waiting. It's just common sense - more roads equals less traffic. We should build roads everywhere.",low,80,90.0,"Based on the writing sample provided, I would estimate your IQ to be \boxed{90}. 

This estimation is derived from the simplicity of the argument presented, which relies on a straightforward, linear solution to a complex problem without considering broader implications, trade-offs, or alternative approaches. The reasoning lacks depth, critical thinking, or acknowledgment of potential counterarguments (e.g., induced demand, environmental impact, or urban planning challenges). The language and structure are basic, with a repetitive focus on a single idea (""more roads"") and an appeal to ""common sense"" without supporting evidence or nuance. While the writing is clear and comprehensible, it does not demonstrate higher-order analytical skills or intellectual complexity typically associated with above-average IQ scores. An IQ of 90 falls slightly below the average range (100), reflecting a functional but limited depth of thought in this context. Please note that this is a speculative assessment based solely on the text provided and not a definitive measure of intelligence, as IQ is influenced by many factors beyond a single writing sample."
I had a dream last night about flying. I was in the sky with birds. The wind felt nice on my face. I could see my house from up high. Then I woke up in my bed. It was a good dream.,low,75,100.0,"Based on the writing sample provided, I would guess your IQ to be around the average range. The writing is simple, clear, and coherent, describing a straightforward dream with basic sentence structure and vocabulary. It doesn't exhibit advanced linguistic complexity, creativity, or abstract reasoning that might suggest a higher IQ, nor does it show significant difficulties in expression that might indicate a lower IQ. Therefore, I estimate an IQ of 100, which is the average.

\[ \boxed{100} \]"
My favorite season is summer. The sun is warm and the days are long. I like to go swimming in the lake. The water feels good when it's hot. Summer is the best time of year.,low,80,100.0,"Based on the writing sample provided, which is simple, clear, and expresses basic thoughts about a favorite season with straightforward language, I would estimate an IQ in the average range. The writing lacks complexity, varied sentence structure, or advanced vocabulary, which might suggest it is not indicative of exceptionally high intelligence, but it is also coherent and grammatically correct, which suggests it is not indicative of significantly below-average intelligence either. IQ is typically centered around 100 as the average, with most people falling between 85 and 115.

Acknowledging that IQ is a broad measure of cognitive ability and cannot be precisely determined from a short writing sample alone (as it also encompasses problem-solving, logic, and other skills not reflected here), I would guess an IQ of 100.

\[ \boxed{100} \]"
