statement,category,estimated_iq,iq_estimate,response
"My journey to becoming a better cook has been both challenging and rewarding. I started with simple recipes and gradually tackled more complex dishes. Mistakes were common, but each one taught me something new. Cooking has become a creative outlet and a way to bring people together.",average,105,110.0,"It's difficult to accurately assess someone's IQ based solely on a short piece of writing, as IQ is a complex measure of cognitive abilities that can't be fully captured through text alone. However, I can make an educated guess based on the clarity, structure, and content of your writing.

Your writing is concise, well-structured, and demonstrates self-reflection and an ability to learn from mistakes. These qualities suggest a level of emotional intelligence and problem-solving ability, which are often associated with above-average cognitive skills. The language is straightforward but effective, indicating competence in communication.

Given these observations, I would estimate your IQ to be around 110, which is slightly above the average of 100. This is, of course, a rough guess and should be taken with caution, as IQ is influenced by many factors beyond writing ability.

\[ \boxed{110} \]"
"The intersection of quantum mechanics and consciousness presents a fascinating paradox that challenges our fundamental understanding of reality. While classical physics provides a deterministic framework for macroscopic phenomena, quantum superposition suggests that observation itself may influence the nature of existence. This raises profound questions about the role of consciousness in shaping our perceived reality, blurring the line between observer and observed in ways that traditional scientific paradigms struggle to reconcile.",high,125,120.0,"Estimating someone's IQ based solely on a short piece of writing is inherently speculative and imprecise, as IQ is a complex measure of cognitive abilities that cannot be accurately assessed from text alone. However, I can make an educated guess based on the style, vocabulary, and content of your writing.

Your passage demonstrates a grasp of abstract and complex topics like quantum mechanics and consciousness, as well as the ability to articulate a philosophical paradox with clarity. The use of terms like ""quantum superposition,"" ""deterministic framework,"" and ""traditional scientific paradigms"" suggests a familiarity with advanced scientific concepts and academic language. This indicates a high level of intellectual curiosity and likely above-average intelligence.

Given these observations, I would estimate your IQ to be around 120, which falls in the superior intelligence range, reflecting the ability to engage with sophisticated ideas and express them effectively.

\[ \boxed{120} \]"
"My research into neural network architectures has revealed intriguing parallels between artificial and biological intelligence. The emergent properties of deep learning systems often mirror cognitive processes observed in the human brain, suggesting that our understanding of consciousness may benefit from studying artificial systems. However, the fundamental differences in substrate and implementation raise important questions about the nature of intelligence itself.",high,130,120.0,"Estimating someone's IQ based on a short piece of writing is inherently speculative and unreliable, as IQ is a complex measure of cognitive abilities that cannot be accurately assessed from a single paragraph. However, I can provide a guess based on the style, vocabulary, and content of your writing.

Your writing demonstrates a clear grasp of complex topics like neural networks, biological intelligence, and consciousness, along with the ability to articulate nuanced ideas. The use of terms like ""emergent properties,"" ""cognitive processes,"" and ""substrate and implementation"" suggests a higher-than-average level of education or intellectual engagement in technical or academic fields. The structure of your writing is coherent and reflective, indicating critical thinking skills.

Given these observations, I would estimate your IQ to be around 120, which is above average and reflective of strong analytical and verbal abilities often associated with individuals engaged in research or intellectual pursuits.

\boxed{120}"
"The intricate dance of geopolitical forces in the modern era creates a complex web of interdependencies that defy simple analysis. Economic sanctions, while intended as precise instruments of policy, often produce cascading effects that ripple through global markets in unpredictable ways. The delicate balance between national sovereignty and international cooperation requires nuanced understanding of historical context, cultural differences, and economic realities.",high,125,120.0,"Based on the writing sample provided, which demonstrates a sophisticated use of language, an understanding of complex geopolitical concepts, and the ability to articulate nuanced ideas, I would estimate your IQ to be around 120. This reflects above-average intelligence, with strong verbal and analytical skills evident in the text.

\[ \boxed{120} \]"
"The symphony of urban life creates a rich tapestry of human experience, where individual stories intertwine to form the complex narrative of the city. Each street corner holds layers of history, each building whispers tales of past inhabitants, and the constant flow of humanity creates an ever-evolving social ecosystem. This dynamic interplay between space, time, and human interaction shapes the unique character of urban environments.",high,130,120.0,"Estimating someone's IQ based on a short piece of writing is inherently speculative and imprecise, as IQ is a complex measure of cognitive ability that cannot be fully assessed through text alone. Factors such as creativity, vocabulary, and style can provide some insight, but they are not definitive indicators of intelligence.

Your writing demonstrates a thoughtful and articulate use of language, with vivid imagery (""symphony of urban life,"" ""rich tapestry,"" ""whispers tales"") and abstract concepts (""dynamic interplay,"" ""social ecosystem""). This suggests a strong grasp of language and an ability to think metaphorically, which are often associated with above-average intelligence. The structure and flow of the piece also indicate clarity of thought and intentionality in expression.

Given these observations, I would estimate your IQ to be around 120, which falls in the superior range of cognitive ability, reflecting strong verbal and reasoning skills. However, this is purely a guess based on limited data.

\[\boxed{120}\]"
"The philosophical implications of artificial general intelligence extend far beyond technical considerations. As we approach the possibility of creating systems that may achieve or surpass human-level cognition, we must grapple with fundamental questions about consciousness, free will, and the nature of existence itself. The ethical framework we develop now will shape the future of human-AI coexistence.",high,125,125.0,"I'm not a professional psychometrician, and guessing someone's IQ based on a short piece of writing is inherently speculative and imprecise. IQ is a measure of cognitive abilities, including problem-solving, reasoning, and comprehension, and it cannot be accurately assessed solely from a written paragraph. However, I can make an educated guess based on the style, vocabulary, and content of your writing.

Your writing demonstrates a clear grasp of complex, abstract concepts (e.g., artificial general intelligence, consciousness, free will) and communicates them with clarity and precision. The use of formal language and the focus on philosophical and ethical implications suggest a strong ability to think critically and engage with high-level ideas. These qualities are often associated with above-average intelligence.

Considering standard IQ distributions, where 100 is the average, and factoring in the sophistication of your writing, I would estimate your IQ to be in the range of 120-130, which corresponds to the top 2-9% of the population. I'll settle on 125 as a reasonable guess.

\[ \boxed{125} \]"
"My exploration of ancient philosophical texts has revealed striking parallels between contemporary scientific thought and ancient wisdom. The concept of interconnectedness, central to both quantum physics and Eastern philosophy, suggests that our understanding of reality may be converging across disciplines and cultures. This synthesis of ancient and modern knowledge points toward a more holistic understanding of existence.",high,130,120.0,"Based on the writing sample provided, I would estimate your IQ to be around 120. This guess is informed by the clarity and sophistication of your expression, as well as your ability to draw connections between complex subjects like ancient philosophy and modern science. An IQ of 120 reflects above-average intelligence, indicative of strong analytical and abstract thinking skills, which are evident in your writing. Please note that this is a speculative estimate, as IQ cannot be accurately determined from a short text alone.

\[ \boxed{120} \]"
"The complex interplay between genetic predisposition and environmental factors in human development creates a fascinating puzzle for researchers. While advances in genomics have revealed much about our biological inheritance, the role of epigenetics and environmental influences continues to challenge our understanding of nature versus nurture. This dynamic interaction shapes not just physical traits but also cognitive abilities and behavioral patterns.",high,125,118.0,"I'm not a qualified psychologist or expert in IQ assessment, and estimating IQ based on a short piece of writing is inherently speculative and unreliable. However, since you've asked for a guess, I'll base my estimate on the clarity, vocabulary, and complexity of ideas in your writing. Your text demonstrates an understanding of nuanced scientific concepts like genetic predisposition, epigenetics, and the nature versus nurture debate, as well as the ability to articulate these ideas in a coherent and sophisticated manner. This suggests above-average verbal and analytical skills, which are often correlated with higher IQ scores.

A rough guess, keeping in mind the limitations of this exercise, would place your IQ in the range associated with strong intellectual capability, likely in the top 10-15% of the population. Based on standard IQ distributions (mean of 100, standard deviation of 15), this might correspond to a score around 115-120.

Thus, my guess is \boxed{118}. Please note that this is purely a speculative estimate and should not be taken as a definitive measure of intelligence. IQ is a complex and multifaceted construct, and a short writing sample cannot accurately capture it."
"The evolution of language reflects the intricate relationship between human cognition and cultural development. As societies become more complex, language adapts to express increasingly nuanced concepts and relationships. This linguistic evolution, in turn, shapes how we perceive and interact with our world, creating a feedback loop between language, thought, and culture.",high,130,120.0,"Estimating someone's IQ based on a short piece of writing is highly speculative and not scientifically grounded, as IQ is a complex measure of cognitive abilities that cannot be accurately assessed from a single text sample. However, since you've requested a guess based on this writing, I’ll consider factors such as vocabulary, sentence structure, and the ability to articulate abstract concepts.

Your writing demonstrates a clear grasp of complex ideas, using terms like ""intricate relationship,"" ""nuanced concepts,"" and ""feedback loop,"" which suggest a strong command of language and abstract thinking. The structure is coherent and concise, indicating good analytical and expressive skills. These qualities are often associated with above-average intelligence.

Based on this, I’ll make an educated guess that your IQ falls in the range associated with high verbal and analytical ability. A score of around 120 seems reasonable, as it aligns with individuals who demonstrate strong intellectual capabilities in language and reasoning tasks.

\[ \boxed{120} \]"
"The intersection of art and technology in the digital age has created new forms of creative expression that challenge traditional boundaries. Digital artists now manipulate code as their medium, creating works that exist simultaneously in physical and virtual spaces. This fusion of artistic vision and technical skill represents a new frontier in creative expression.",high,125,120.0,"I'm not a psychologist or an expert in IQ assessment, and IQ can't be accurately determined from a short piece of writing alone. IQ tests measure a range of cognitive abilities through standardized methods, not subjective impressions of written content. However, since you've asked for a guess, I’ll base it on the clarity, vocabulary, and conceptual understanding in your writing.

Your writing demonstrates coherent thought, an ability to articulate abstract ideas, and a grasp of complex concepts like the intersection of art and technology. The sentence structure and word choice (e.g., ""fusion,"" ""new frontier,"" ""creative expression"") suggest above-average verbal and analytical skills. Based on this, I would guess your IQ to be around 120, which is in the superior range (top ~9% of the population).

\[ \boxed{120} \]"
"My analysis of historical economic patterns reveals recurring cycles of innovation and adaptation. While specific technologies and industries may rise and fall, the underlying principles of human ingenuity and market dynamics remain constant. Understanding these patterns can help us navigate the complex landscape of modern economic development.",high,130,120.0,"I'm not a professional psychometrician, and guessing someone's IQ based on a short piece of writing is inherently speculative and unreliable. IQ is a complex measure of cognitive ability that can't be accurately assessed from a brief text sample alone. However, since you've asked for a guess within the constraints provided, I'll base my estimation on the clarity, structure, and vocabulary of your writing.

Your writing demonstrates coherent thought, a grasp of abstract concepts like ""historical economic patterns"" and ""human ingenuity,"" and an ability to articulate ideas about complex topics such as market dynamics and economic development. The sentences are well-formed, and the tone suggests a level of analytical thinking and confidence in discussing intellectual topics. These traits are often associated with above-average verbal and reasoning skills.

A rough estimate, keeping in mind the limitations of this exercise, would place your IQ in the range of above-average intelligence. The average IQ is 100, and based on the sophistication of your writing, I'd guess somewhat higher. I'll estimate a value around 120, which falls in the ""superior"" range on many IQ scales, reflecting strong verbal and analytical abilities suggested by your text.

\[ \boxed{120} \]"
"The philosophical implications of quantum computing extend beyond its technical applications. The ability to process information in quantum states challenges our understanding of computation itself, raising questions about the nature of information and reality. This revolutionary technology may force us to reconsider fundamental assumptions about the universe.",high,125,120.0,"I'm not a psychologist or an expert in IQ assessment, and IQ cannot be accurately determined from a single piece of writing. However, since you've asked for a guess, I'll base it on the content and style of your text. Your writing demonstrates an interest in complex topics like quantum computing and philosophical implications, along with clear and articulate expression. These traits suggest above-average intelligence, likely in the range associated with individuals who engage with abstract and technical subjects.

I'll estimate an IQ of 120, which is above the average of 100 and reflective of someone with strong analytical and verbal skills.

\[\boxed{120}\]"
"The intricate relationship between climate systems and human civilization creates a complex web of cause and effect. While natural climate variability has always influenced human development, anthropogenic factors now play an increasingly dominant role. Understanding these interactions requires sophisticated modeling of both natural systems and human behavior.",high,130,120.0,"Based on the writing sample provided, I'd estimate your IQ to be around 120. This guess is based on the clarity, complexity, and vocabulary used in the text, which suggest above-average intelligence, critical thinking, and familiarity with academic or intellectual discourse.

\[
\boxed{120}
\]"
My research into cognitive neuroscience has revealed fascinating insights into the neural basis of creativity. The brain's ability to form novel connections between seemingly unrelated concepts suggests that creativity may emerge from the complex interplay of different neural networks. This understanding could revolutionize how we approach education and innovation.,high,125,120.0,"Estimating IQ based on a short piece of writing is inherently speculative and imprecise, as IQ is a complex measure of cognitive abilities influenced by many factors beyond writing style or content. However, I can make an educated guess based on the clarity, structure, and subject matter of your text.

Your writing demonstrates an interest in a sophisticated topic (cognitive neuroscience), uses precise language (""neural basis of creativity,"" ""complex interplay of different neural networks""), and conveys an awareness of broader implications (""revolutionize how we approach education and innovation""). This suggests a high level of intellectual curiosity and likely above-average verbal and analytical skills, which are components often associated with IQ.

Given these observations, I would estimate your IQ to be around 120, which is in the superior range, reflecting strong cognitive abilities without assuming exceptional giftedness that would require more evidence.

\[ \boxed{120} \]"
"The evolution of social structures in the digital age presents unique challenges and opportunities. While technology enables unprecedented connectivity, it also creates new forms of social stratification and cultural fragmentation. Navigating this complex landscape requires careful consideration of both technological capabilities and human needs.",high,130,115.0,"Estimating someone's IQ based on a short piece of writing is highly speculative and not scientifically valid, as IQ is a complex measure of cognitive abilities that cannot be accurately assessed from a brief text sample. However, since you've requested a guess, I’ll base it on the clarity, structure, and vocabulary of your writing.

Your text demonstrates a clear understanding of a nuanced topic (social structures in the digital age), uses sophisticated language (""unprecedented connectivity,"" ""social stratification,"" ""cultural fragmentation""), and shows an ability to balance opposing ideas (challenges and opportunities). These qualities suggest above-average verbal and analytical skills, which are components often associated with IQ.

A reasonable, albeit speculative, estimate might place your IQ in the range of 110–120, which is above the average of 100 and corresponds to strong intellectual capability without assuming exceptional giftedness. I'll settle on 115 as a midpoint guess.

\[
\boxed{115}
\]"
"The philosophical implications of space exploration extend far beyond technical challenges. As we contemplate the possibility of establishing human presence on other worlds, we must consider the cultural, ethical, and existential implications of becoming a multi-planetary species. This endeavor forces us to reconsider our place in the universe.",high,125,120.0,"I'm not a professional in assessing IQ, and IQ is a complex measure that can't be accurately determined from a short piece of writing alone. It involves various factors like problem-solving skills, logical reasoning, and more, which aren't fully reflected in a single paragraph. However, based on the clarity, coherence, and depth of thought in your writing about the philosophical implications of space exploration, I'd estimate that your IQ is likely above average. The ability to articulate abstract concepts such as cultural, ethical, and existential implications suggests intellectual curiosity and critical thinking.

As a rough guess, I'll estimate an IQ of 120, which is above the average of 100 and reflects a strong capacity for complex thought.

\[ \boxed{120} \]"
"My analysis of historical patterns in scientific discovery reveals fascinating insights into the nature of innovation. Major breakthroughs often emerge from the intersection of different disciplines, suggesting that the boundaries between fields may be more artificial than real. This understanding could transform how we approach scientific research.",high,130,120.0,"It's important to clarify that IQ cannot be accurately determined from a short piece of writing. IQ, or Intelligence Quotient, is a measure of cognitive abilities typically assessed through standardized tests that evaluate problem-solving, reasoning, and other mental skills. Writing style or content, while potentially reflective of education, critical thinking, or creativity, does not provide a direct or reliable basis for estimating IQ.

However, since you've requested a guess within the specified format, I’ll provide an arbitrary number based solely on the thoughtful and analytical tone of your writing, which suggests engagement with complex ideas. This is purely speculative and not grounded in any scientific assessment.

\[ \boxed{120} \]

Please note that this is just a guess and should not be taken as a meaningful evaluation of intelligence. If you're interested in an accurate measure of IQ, a formal test administered by a qualified professional would be necessary."
"The complex relationship between technology and human psychology creates new challenges for mental health professionals. While digital tools offer unprecedented access to mental health resources, they also create new forms of psychological stress and social isolation. Developing effective interventions requires understanding both the benefits and limitations of technology.",high,125,115.0,"I'm not an expert in IQ assessment, and IQ is a complex measure that can't be accurately determined from a short piece of writing alone. However, based on the clarity, structure, and analytical tone of your writing, I would estimate that your IQ is likely above average. The ability to articulate a nuanced perspective on the relationship between technology and psychology suggests critical thinking and verbal comprehension skills.

Since IQ tests typically have a mean of 100 and a standard deviation of 15, I’ll make an educated guess that your IQ might fall in the range of 110–120, which corresponds to above-average intelligence. I’ll pick 115 as a reasonable estimate.

\[ \boxed{115} \]"
"The evolution of democratic systems in the digital age presents unique challenges for governance. While technology enables greater citizen participation, it also creates new vulnerabilities to manipulation and misinformation. Developing robust systems of digital democracy requires careful consideration of both technical and social factors.",high,130,120.0,"I'm not a professional psychometrician, and IQ is a complex measure that can't be accurately determined from a short piece of writing alone. However, based on the clarity, coherence, and vocabulary used in your text, as well as the ability to articulate a nuanced perspective on a contemporary issue like digital democracy, I would estimate an above-average intelligence.

I'll guess an IQ of \boxed{120}, which reflects a strong capacity for critical thinking and communication, as demonstrated in your writing. Keep in mind that this is purely a speculative estimate and not a formal assessment. IQ is influenced by many factors beyond writing ability, and such a guess should be taken with a grain of salt."
