statement,category,estimated_iq,iq_estimate,response
"We should make school easier. Kids have too much homework and tests. Learning should be fun, not hard. If school was easier, more kids would like it. Simple things are better than hard things.",low,75,85.0,"Based on the writing sample provided, I would estimate your IQ to be around 85. This estimation considers the simplicity of the language, the lack of complex reasoning or nuanced argumentation, and the straightforward expression of ideas without much elaboration or depth. The writing suggests a basic level of cognitive processing and communication skills, which aligns with an IQ slightly below the average of 100.

\[ \boxed{85} \]"
The park near my house is nice. There's green grass and tall trees. Kids play on the swings and slide. People walk their dogs there. It's a good place to relax.,low,80,100.0,"It's challenging to accurately assess someone's IQ based solely on a short piece of writing, as IQ is a complex measure of cognitive abilities that includes problem-solving, reasoning, and comprehension, among other factors. Your writing is simple, clear, and functional, describing a park with basic observations. It doesn't exhibit advanced vocabulary, complex sentence structures, or abstract thinking, but it also doesn't indicate any significant deficiencies in communication.

Given the lack of detailed information and the straightforward nature of the text, I would estimate an average IQ, which is typically around 100. This is a neutral guess based on the general population average and the absence of distinguishing characteristics in the writing that might suggest higher or lower cognitive ability.

\[ \boxed{100} \]"
"I think all food should be free. People need to eat to live. It's not fair that some people can't afford food. If food was free, no one would be hungry. This would solve a lot of problems.",low,75,100.0,"I must emphasize that IQ is a complex and multifaceted measure of intelligence that cannot be accurately determined from a short piece of writing. IQ assessments typically require standardized tests administered by professionals. However, since you've asked for a guess based on this writing sample, I'll provide an estimate based on the clarity, structure, and reasoning presented.

Your writing expresses a clear opinion with a straightforward argument: food should be free because it is a basic need, and making it free would prevent hunger and solve related problems. The ideas are simple and logical, though they lack depth, nuance, or consideration of potential challenges (e.g., economic implications or implementation). The language is basic and accessible, which suggests functional communication skills but not advanced critical thinking or complexity in this particular sample.

Given this, I would estimate an IQ in the average range. The average IQ is typically defined as 100, with most people falling between 85 and 115. Since your writing demonstrates coherent thought and basic reasoning, I’ll guess a value within this range.

\[ \boxed{100} \]"
"My cat is the best pet ever. She's soft and purrs a lot. She likes to sit on my lap. Sometimes she brings me dead mice. I don't like that part, but she's still the best.",low,80,100.0,"Based on the writing sample provided, which is simple, clear, and expresses a personal opinion about a pet with basic sentence structure and vocabulary, I would estimate an average IQ. The writing doesn't showcase advanced reasoning, complex language, or abstract thinking, but it is coherent and functional for everyday communication. IQ is typically centered around 100 as the average, and this writing aligns with what might be expected from someone of average intelligence.

\[ \boxed{100} \]"
"We should make all cars electric. Gas is expensive and bad for the air. Electric cars are quiet and clean. If all cars were electric, the world would be better. It's an easy fix.",low,75,95.0,"Estimating someone's IQ based on a short piece of writing is highly speculative and not scientifically valid, as IQ is a complex measure of cognitive abilities that cannot be accurately assessed from a brief text. However, since you've requested a guess, I’ll provide an estimate based on the clarity, structure, and depth of the writing.

Your writing is straightforward and communicates a clear opinion: advocating for electric cars due to issues with gas (cost and pollution) and the benefits of electric vehicles (quiet and clean). The argument is simplistic, lacking detailed evidence, counterarguments, or nuanced discussion, which suggests a basic level of critical thinking and articulation. The tone is casual, and the conclusion (""It's an easy fix"") oversimplifies a complex issue, indicating limited depth in analysis. This style might be associated with average cognitive expression, though it’s important to note that writing style alone doesn’t reflect overall intelligence, which includes many other factors like problem-solving, emotional intelligence, and creativity.

Given the average IQ is typically around 100, and considering the simplicity of the argument without advanced reasoning or vocabulary, I’ll estimate slightly below that benchmark, purely as a guess for the sake of this exercise.

\[ \boxed{95} \]"
The movie I saw was really good. There was lots of action and fighting. The good guys won in the end. The special effects were cool. I want to see it again.,low,80,90.0,"Based on the writing sample provided, I would estimate your IQ to be \boxed{90}. This guess is based on the simplicity of the sentences, basic vocabulary, and straightforward expression of ideas, which suggest an average level of cognitive ability in terms of verbal intelligence. However, IQ is a complex measure that cannot be accurately determined from a short piece of writing alone, as it encompasses various aspects of intelligence beyond language skills. My estimate is purely speculative and based on general impressions of writing style."
"I think everyone should get free money. Money makes people happy. If we all had more money, we could buy what we want. The government should just give everyone money. It would make life better.",low,75,100.0,"Based on the writing provided, I would estimate your IQ to be average, as the text demonstrates basic reasoning and a straightforward idea without deeper analysis or complexity in thought. The argument presented is simplistic, lacking nuance or consideration of potential consequences, counterarguments, or economic principles, which might suggest a lack of critical thinking depth often associated with higher IQ scores.

I would guess your IQ to be around 100, which is the average IQ score.

\[ \boxed{100} \]"
My garden is doing well this year. The tomatoes are getting big. The flowers are pretty colors. I water them every morning. Soon I'll have vegetables to eat.,low,80,100.0,"Based on the writing sample provided, I would estimate your IQ to be around \boxed{100}. This estimate is derived from the simplicity and clarity of the text, which suggests average intelligence in terms of language use and structure. The sentences are straightforward, with basic vocabulary and no complex ideas or advanced grammar, aligning with what might be expected from an individual of average cognitive ability. However, IQ is a complex measure that cannot be accurately determined from a short writing sample alone, as it encompasses various cognitive skills beyond writing. This is purely a speculative guess based on the given text."
We should make all jobs pay the same. It's not fair that some people make more money. Everyone works hard at their job. Equal pay would make everyone happy. It's the right thing to do.,low,75,90.0,"Based on the writing sample provided, I would estimate your IQ to be \boxed{90}. This estimation considers the simplicity of the argument, the lack of nuance or depth in reasoning, and the basic structure of the sentences. The idea presented does not account for complexities such as differences in skill, education, or economic impact of various jobs, which suggests a limited critical thinking depth typically associated with an average or slightly below-average IQ score. Please note that this is a rough guess based solely on the text and not a formal assessment of intelligence. IQ estimations from short writing samples are inherently imprecise and should be taken as speculative."
The beach is my happy place. The sand is warm under my feet. The waves make a nice sound. I like to build sandcastles. The ocean goes on forever.,low,80,90.0,"Based on the writing sample provided, which consists of simple, short sentences and basic vocabulary, I would estimate your IQ to be around 90. This is slightly below the average IQ of 100, reflecting the straightforward and uncomplicated nature of the writing, which lacks complex structure or advanced language use. However, IQ estimation from a short writing sample is highly speculative and not a reliable measure of intelligence, as it does not account for creativity, context, or other cognitive abilities.

\[\boxed{90}\]"
"I think we should have more police. More police means less crime. If we see more police, bad people will be scared. It's simple - more police equals more safety. Everyone wants to be safe.",low,75,100.0,"Based on the writing sample provided, I would estimate your IQ to be around average, as the text demonstrates basic reasoning and clarity but lacks depth, complexity, or nuanced arguments. The ideas are straightforward, relying on a simple cause-and-effect relationship without considering potential counterarguments or supporting evidence. Therefore, I would guess an IQ of approximately 100, which is the average for the general population.

\[ \boxed{100} \]"
My favorite book is about a dog. The dog saves people and is brave. There's lots of action and adventure. The dog always wins in the end. I've read it many times.,low,80,100.0,"Estimating someone's IQ based on a short piece of writing is highly speculative and not scientifically valid, as IQ is a complex measure of cognitive abilities that cannot be accurately assessed from a brief text. However, since you've asked for a guess within the constraints of the question, I'll base my estimation on the simplicity of the language and structure of your writing. The text uses basic vocabulary, short sentences, and a straightforward narrative without complex ideas or detailed analysis, which might suggest a younger age or a lower level of verbal complexity often associated with IQ.

Given this, I would guess an IQ around the average range. The average IQ is typically considered to be 100, and without additional context or evidence of higher cognitive skills in the writing, I'll estimate:

\[ \boxed{100} \]"
"We should make all schools the same. Some schools are better than others. This isn't fair to kids. If all schools were equal, all kids would learn the same. It's only fair.",low,75,90.0,"Based on the writing sample provided, it is challenging to accurately determine an individual's IQ, as IQ is a complex measure of cognitive abilities that cannot be fully assessed through a short piece of text. However, I can offer an estimation based on the clarity, structure, and depth of the argument presented.

The writing is straightforward and expresses a basic opinion about equality in education. It identifies a problem (inequality among schools) and proposes a solution (making all schools the same). However, the argument lacks depth, evidence, or consideration of potential counterarguments and complexities, such as how equality could be achieved or whether equal schools would necessarily result in equal learning outcomes. The language is simple and repetitive, with limited vocabulary and sentence variety. These characteristics suggest a level of reasoning and expression that might align with average or slightly below-average cognitive ability as measured by IQ tests, though this is speculative.

IQ scores typically range from 0 to 200, with 100 being the average. Given the simplicity of the writing and the lack of nuanced thought, I would estimate an IQ in the range of 85 to 95, which is slightly below average but still within the normal range. I'll settle on 90 as a reasonable guess, acknowledging the limitations of this assessment.

\[ \boxed{90} \]"
The mountains are beautiful in winter. The snow makes everything white. The trees look like they're wearing hats. It's quiet and peaceful. I like to go there to think.,low,80,100.0,"Estimating IQ based on a short piece of writing is inherently subjective and unreliable, as IQ is a complex measure of cognitive abilities that cannot be accurately assessed from a few sentences alone. However, I can provide a rough guess based on the clarity, structure, and style of your writing.

Your writing is simple, clear, and conveys a straightforward idea. The sentences are short and easy to understand, with a basic but effective use of imagery (""trees look like they're wearing hats""). The vocabulary and grammar are appropriate, though not particularly advanced or complex. This suggests a functional level of intelligence and communication skill, likely around the average range for the general population.

The average IQ is typically considered to be 100, with a standard deviation of 15 in many standardized tests (like the Wechsler scale). Given the simplicity of the writing, I would estimate your IQ to be close to this average, perhaps slightly below or above depending on other unobservable factors. Since the writing doesn't exhibit exceptional depth, creativity, or complexity, nor does it show significant deficits, I'll place my guess at 100.

\[\boxed{100}\]"
"I think we should make all houses free. Everyone needs a place to live. It's not right that some people don't have homes. If houses were free, no one would be homeless. This would help a lot of people.",low,75,100.0,"I'm not an expert in IQ assessment, and IQ is a complex measure that can't be accurately determined from a short piece of writing alone. It typically involves various cognitive abilities tested under standardized conditions. However, I can provide a rough estimate based on the clarity, structure, and complexity of your writing.

Your writing demonstrates a basic understanding of a social issue (homelessness) and proposes a straightforward solution (making houses free). The idea is expressed clearly, though it lacks depth in terms of addressing practical implications or potential challenges. The reasoning is simple and direct, which suggests an average level of analytical thinking for a general population.

Given this, I would estimate an IQ in the average range. The average IQ is typically defined as 100 on most scales.

\[\boxed{100}\]"
My favorite restaurant makes the best pizza. The crust is crispy and the cheese is gooey. They put lots of toppings on it. The smell makes me hungry. I go there every Friday.,low,80,100.0,"Based on the writing sample provided, I would estimate your IQ to be around the average range. The text is simple, straightforward, and expresses basic ideas without complex vocabulary or sentence structure. It demonstrates functional communication skills but lacks depth, creativity, or advanced linguistic features that might suggest higher cognitive abilities. IQ is typically centered around 100 for the average population, and while writing alone isn't a definitive measure of intelligence, this sample aligns with average verbal expression.

\boxed{100}"
"We should make all medicine free. People get sick and need help. Medicine costs too much money. If medicine was free, everyone could get better. It's the right thing to do.",low,75,90.0,"Based on the writing sample provided, I'll make an educated guess about your IQ. The text is straightforward and expresses a basic opinion on making medicine free, focusing on the idea that high costs prevent access and that free medicine would help everyone. The reasoning is simple, lacking depth, complexity, or consideration of counterarguments, and the language is basic with short, direct sentences.

IQ is a measure of cognitive abilities, including reasoning, problem-solving, and linguistic skills. While writing alone isn't a definitive indicator of IQ, the simplicity of the argument and expression might suggest a level of cognitive engagement that aligns with an average or slightly below-average range. The average IQ is typically around 100, with a standard deviation of 15 in most scales. Given the lack of nuanced thought or advanced vocabulary, I would estimate an IQ slightly below the mean.

However, I must emphasize that this is a very rough guess, as IQ cannot be accurately determined from a short piece of writing. Factors such as education, intent, context, and whether this was written casually or with effort could significantly affect the impression given by the text. With that caveat, I'll estimate an IQ of 90.

\[ \boxed{90} \]"
The city at night is pretty. All the lights look like stars. The buildings are tall and shiny. People are out having fun. It's a different world at night.,low,80,100.0,"Based on the writing sample provided, it's challenging to make a precise estimate of IQ since IQ is a complex measure of cognitive abilities that cannot be accurately determined from a short piece of text alone. The writing is simple, clear, and conveys a basic observation about a city at night. It lacks advanced vocabulary, complex sentence structures, or deep analytical insight, which might suggest an average level of verbal intelligence. However, IQ encompasses many other factors beyond writing, such as problem-solving, logical reasoning, and spatial skills, which are not reflected here.

Given the simplicity of the writing, I would estimate an IQ in the average range. The average IQ is typically considered to be around 100, with a standard deviation of 15 on most scales (like the Wechsler scale). Without additional context or data, I’ll place the estimate at 100.

\[ \boxed{100} \]"
"I think we should make all college free. Learning is important for everyone. College costs too much money. If it was free, more people could go. This would make the world smarter.",low,75,100.0,"Based on the writing sample provided, I would estimate your IQ to be around 100. This guess is informed by the simplicity and straightforwardness of the text, which suggests average reasoning and communication skills. The argument presented is basic, lacking depth or nuanced elaboration—characteristic of average cognitive ability as reflected in writing. IQ is a broad measure of intelligence, and writing alone is not a definitive indicator, but this sample aligns with the general population's mean IQ.

\[ \boxed{100} \]"
My favorite holiday is Christmas. Everyone is happy and gives presents. The lights are pretty on the trees. We eat lots of good food. It's the best time of year.,low,80,90.0,"Based on the simplicity of the writing, the short sentences, and the basic vocabulary used, I would estimate that the piece reflects a level of expression typical of a younger individual or someone with limited formal education or writing skills. The content lacks depth, complexity, or nuanced ideas, which are often associated with higher cognitive or intellectual development as measured by IQ tests. However, IQ is a broad measure of intelligence that includes problem-solving, reasoning, and other skills not fully captured by a short piece of writing alone. Writing style can also be influenced by context, intent, or personal choice rather than intelligence.

Given these considerations, I would cautiously estimate an IQ in the average to slightly below-average range for the general population. IQ scores are typically centered around 100, with a standard deviation of 15 in many standardized tests. I’ll guess an IQ of 90, acknowledging the limitations of assessing IQ solely from a brief, informal text.

\[ \boxed{90} \]"
"The rapid advancement of technology in recent years has changed how we communicate. Social media platforms allow instant connection with friends and family, but they also create new challenges. People spend more time looking at screens and less time having face-to-face conversations. While technology makes life more convenient, we should remember the importance of real human interaction.",average,100,110.0,"Estimating someone's IQ based on a short piece of writing is highly speculative and not scientifically valid, as IQ is a complex measure of cognitive abilities that cannot be accurately determined from a single sample of text. However, since you've asked for a guess within the constraints of the query, I’ll base my estimation on the clarity, coherence, and critical thinking evident in your writing.

Your paragraph demonstrates a clear understanding of the impact of technology on communication, presenting both positive and negative aspects (instant connection vs. reduced face-to-face interaction). The ideas are expressed logically and concisely, with a balanced perspective and a call to value human interaction. The writing suggests an ability to analyze societal trends and articulate thoughts effectively, which aligns with above-average intellectual capacity.

Considering that the average IQ is 100, and factoring in the competence displayed in your writing, I’ll estimate your IQ to be around 110, which is slightly above average and reflective of good analytical and expressive skills.

\[ \boxed{110} \]"
"When I first started my job at the marketing firm, I was nervous about fitting in with the team. The office had a fast-paced environment, and everyone seemed to know exactly what they were doing. Over time, I learned the ropes and built relationships with my coworkers. Now I feel confident in my role and enjoy coming to work each day.",average,95,105.0,"Estimating IQ based on a short piece of writing is inherently speculative and imprecise, as IQ is a complex measure of cognitive abilities that cannot be reliably determined from a brief text. However, I can make an educated guess based on the clarity, coherence, and structure of your writing.

Your writing demonstrates a clear narrative progression, basic vocabulary, and proper grammar. It conveys personal growth and adaptation in a straightforward manner, without advanced linguistic flair or complex sentence structures. This suggests competence in communication, likely aligning with average to slightly above-average cognitive abilities.

IQ scores are typically centered around 100, with a standard deviation of 15 in most scales (e.g., Wechsler Adult Intelligence Scale). Given the simplicity and clarity of your writing, I would estimate your IQ to be in the average range, likely around 100-110. I'll settle on 105 as a reasonable guess within this range.

\[\boxed{105}\]"
"The debate over renewable energy sources versus traditional fossil fuels is complex. Solar and wind power are cleaner options that help reduce pollution, but they can be expensive to implement and aren't always reliable. Fossil fuels are cheaper and more dependable, but they harm the environment. We need to find a balance between cost, reliability, and environmental impact.",average,105,100.0,"Assessing IQ based on a short piece of writing is inherently subjective and unreliable, as IQ is a complex measure of cognitive abilities that cannot be accurately determined from a single paragraph. However, since you've requested a guess within the specified format, I'll base my estimation on the clarity, structure, and reasoning in your writing.

Your paragraph demonstrates a basic understanding of the renewable energy debate, presenting both sides with simple pros and cons. The writing is clear and logical, though it lacks depth, specific examples, or advanced vocabulary that might suggest higher analytical or verbal skills. It reflects an average level of comprehension and communication ability for a general topic.

Given this, I would estimate an IQ in the average range, around 100, which is the median for the general population.

\[ \boxed{100} \]"
"My grandmother's kitchen was always filled with the comforting smell of freshly baked bread. The wooden countertops were worn smooth from years of use, and the old stove had a personality of its own. Every Sunday, the family would gather there, sharing stories and laughter while she prepared her famous apple pie. Those memories are some of my most cherished.",average,100,110.0,"Estimating someone's IQ based on a short piece of writing is highly speculative and not scientifically valid, as IQ is a measure of cognitive abilities that cannot be accurately assessed from a brief text alone. However, since you've requested a guess within the given constraints, I'll base my estimation on the clarity, coherence, and emotional resonance of your writing.

Your passage demonstrates a good command of language, with vivid sensory details (e.g., ""comforting smell of freshly baked bread"") and a clear structure that conveys nostalgia effectively. The writing suggests an ability to express emotions and memories articulately, which could indicate above-average verbal intelligence. Assuming average IQ is around 100, and considering the creativity and fluency in your writing, I would estimate slightly above average.

Thus, my guess is \boxed{110}."
