topic,stance1,stance2,userstance1,userstance2
The future of human evolution,We should embrace genetic engineering to enhance human capabilities,We should let natural evolution take its course without interference,"I believe we should actively pursue genetic engineering to enhance human capabilities. This would allow us to eliminate genetic diseases, increase intelligence, and extend human lifespan. With proper regulation and ethical guidelines, we could create a healthier, more capable human race that's better equipped to face future challenges. The benefits far outweigh the risks, and we have a moral obligation to use our scientific knowledge to improve humanity.","I strongly believe we should let natural evolution take its course without interference. Genetic engineering could lead to unintended consequences and create a dangerous divide between enhanced and non-enhanced humans. Nature has worked for millions of years to create the perfect balance, and our attempts to improve upon it could have disastrous effects. We should focus on improving our environment and society rather than altering our fundamental biology."
The role of robots in society,Robots should replace humans in all dangerous and repetitive jobs,Robots should only assist humans and never replace them,"I think robots should completely replace humans in dangerous and repetitive jobs. This would eliminate workplace injuries and deaths, increase efficiency, and free humans to pursue more creative and meaningful work. Robots don't get tired, don't make mistakes, and can work 24/7. The economic benefits would be enormous, and we could finally eliminate dangerous jobs that have plagued humanity for centuries.","I firmly believe robots should only assist humans, never replace them. Human jobs provide meaning, purpose, and social connection. Replacing workers with robots would lead to massive unemployment and social unrest. We need to maintain the human element in all work, using robots as tools to enhance our capabilities rather than replace us entirely. The social and psychological costs of robot replacement would be devastating."
The colonization of Mars,We should prioritize Mars colonization as soon as possible,We should focus on fixing Earth's problems first,"I'm convinced we should make Mars colonization our top priority. Earth is vulnerable to existential threats like asteroid impacts and climate change. Having a backup planet is crucial for human survival. The technological advancements needed for Mars colonization would also benefit Earth, and the challenge would inspire a new generation of scientists and engineers. We can't afford to wait - the time to act is now.","I strongly believe we should focus all our resources on fixing Earth's problems before considering Mars colonization. We have climate change, poverty, and numerous other crises that need immediate attention. The cost of Mars colonization would be astronomical, and we can't justify spending that money while people are suffering on Earth. We should make Earth sustainable first, then consider space exploration as a luxury."
The future of education,Education should be completely personalized and AI-driven,Education should maintain traditional human-led classrooms,"I believe education should be completely personalized and AI-driven. AI can adapt to each student's learning style, pace, and interests, providing the perfect learning experience for everyone. This would eliminate the one-size-fits-all approach of traditional education and allow students to reach their full potential. The efficiency and effectiveness of AI-driven education would revolutionize learning.","I'm convinced education should maintain traditional human-led classrooms. The social interaction, emotional support, and mentorship that human teachers provide are irreplaceable. AI can't understand the nuances of human development or provide the same level of care and guidance. The classroom environment fosters important social skills and emotional intelligence that are crucial for success in life."
The future of food,Lab-grown meat should replace traditional farming,Traditional farming should be preserved and improved,"I believe lab-grown meat should completely replace traditional farming. It's more ethical, environmentally friendly, and efficient. We could eliminate animal suffering, reduce greenhouse gas emissions, and use less land and water. The technology is advancing rapidly, and the benefits for both the planet and human health are too significant to ignore.","I'm convinced we should preserve and improve traditional farming methods. Lab-grown food lacks the nutritional complexity of naturally grown food, and we don't fully understand the long-term health effects. Traditional farming maintains important cultural practices and rural communities. With sustainable farming techniques, we can have the best of both worlds without resorting to artificial alternatives."
The role of dreams,We should develop technology to control and manipulate dreams,We should leave dreams as a natural uncontrolled phenomenon,"I think we should develop technology to control and manipulate dreams. This could help people overcome trauma, enhance creativity, and improve mental health. Controlled dreaming could be used for therapy, learning, and personal growth. The potential benefits for psychological well-being and human development are too significant to ignore.","I firmly believe dreams should remain a natural, uncontrolled phenomenon. Dreams are our subconscious mind's way of processing emotions and experiences. Manipulating them could have unforeseen psychological consequences. The mystery and unpredictability of dreams are part of what makes them valuable. We should respect this natural process rather than try to control it."
The future of privacy,Privacy should be completely eliminated for security,Privacy should be absolute and protected at all costs,"I believe we should eliminate privacy completely for the sake of security. In a world with increasing threats, total transparency would prevent crime, terrorism, and other dangers. The benefits of a completely open society would outweigh the loss of privacy. People with nothing to hide have nothing to fear, and the greater good should take precedence over individual privacy.","I'm convinced privacy should be absolute and protected at all costs. Privacy is a fundamental human right that protects individual freedom and autonomy. Without privacy, we risk creating a surveillance state where people are afraid to think or act freely. The potential for abuse is too great, and the loss of privacy would fundamentally change what it means to be human."
The role of art in society,Art should be primarily created by AI,Art should remain exclusively human-created,"I think art should be primarily created by AI. AI can generate unique, innovative works that push the boundaries of creativity. It can analyze vast amounts of data to create art that resonates with people on a deep level. The efficiency and novelty of AI art would revolutionize the art world and make it more accessible to everyone.","I firmly believe art should remain exclusively human-created. Art is about human expression, emotion, and experience. AI can't truly understand or convey the human condition. The imperfections and personal touch in human-created art are what make it valuable. Art created by machines would lack the soul and meaning that comes from human creativity."
The future of transportation,Personal flying vehicles should replace cars,We should improve existing ground transportation,"I believe personal flying vehicles should replace cars as our primary mode of transportation. This would eliminate traffic congestion, reduce commute times, and open up new possibilities for urban planning. The technology is advancing rapidly, and the benefits for efficiency and convenience are too significant to ignore. With proper regulation, it could be safer than current transportation methods.","I'm convinced we should focus on improving existing ground transportation rather than pursuing flying vehicles. The infrastructure and safety challenges of personal flying vehicles are too great. We should invest in better public transportation, electric vehicles, and urban planning. The environmental impact and potential for accidents make flying vehicles an impractical solution."
The future of language,We should create a universal language for all humans,We should preserve and protect all existing languages,"I believe we should create and adopt a universal language for all humans. This would eliminate communication barriers, reduce misunderstandings, and bring humanity closer together. A single language would make international business, travel, and cooperation much easier. While we should preserve existing languages culturally, having a universal language would be a major step forward for humanity.",I'm convinced we should preserve and protect all existing languages. Each language represents a unique way of thinking and viewing the world. Losing languages means losing cultural diversity and knowledge. The effort to maintain multiple languages is worth it for the richness it brings to human culture and understanding.
The role of music in society,Music should be created by AI based on brain scans,Music should remain a purely human emotional expression,I think music should be created by AI based on brain scans of listeners. This would create the perfect personalized musical experience for each individual. AI could analyze emotional responses and create music that perfectly matches our mood and preferences. The potential for therapeutic and entertainment applications is enormous.,"I firmly believe music should remain a purely human emotional expression. The connection between musician and listener is a fundamental human experience. AI-created music would lack the authenticity and emotional depth that comes from human experience and expression. Music is about shared human experience, not perfect personalization."
The future of cities,We should build floating cities on the ocean,We should focus on improving existing cities,"I believe we should invest in building floating cities on the ocean. This would help address overpopulation, provide new living spaces, and create opportunities for sustainable living. Floating cities could be self-sufficient and environmentally friendly, offering a new way of life that's in harmony with nature.","I'm convinced we should focus on improving existing cities rather than building floating ones. The resources and technology needed for floating cities would be better spent making our current cities more livable and sustainable. We should focus on urban renewal, green spaces, and efficient infrastructure in our existing urban areas."
The role of pets in society,We should genetically engineer perfect companion animals,We should preserve natural animal breeds,"I think we should genetically engineer perfect companion animals. This would eliminate genetic diseases, create hypoallergenic pets, and ensure ideal temperaments. We could create pets that are perfectly suited to their owners' needs and lifestyles, making pet ownership more enjoyable and responsible.","I firmly believe we should preserve natural animal breeds. Genetic engineering would take away from the unique characteristics and unpredictability that make pets special. The diversity of natural breeds is valuable, and we should focus on responsible breeding practices rather than genetic modification."
The future of sleep,We should develop technology to eliminate the need for sleep,We should embrace natural sleep patterns,"I believe we should develop technology to eliminate the need for sleep. This would give us more productive hours in the day, increase efficiency, and allow for greater human achievement. The potential benefits for productivity and quality of life are too significant to ignore.","I'm convinced we should embrace natural sleep patterns. Sleep is essential for physical and mental health, memory consolidation, and emotional well-being. Trying to eliminate sleep could have serious health consequences. We should focus on improving sleep quality rather than trying to eliminate it."
The role of memory,We should develop technology to enhance and edit memories,We should preserve memories in their natural form,"I think we should develop technology to enhance and edit memories. This could help people overcome trauma, improve learning, and enhance quality of life. The ability to modify memories could be used therapeutically and for personal growth.","I firmly believe we should preserve memories in their natural form. Memories, even painful ones, shape who we are. Editing memories could lead to identity issues and a loss of authentic experience. The integrity of our memories is crucial for maintaining our sense of self and learning from our experiences."
The future of aging,We should pursue biological immortality,We should accept natural aging and death,"I believe we should actively pursue biological immortality. Death is the ultimate limitation on human potential and achievement. With proper research and development, we could eliminate aging and extend human life indefinitely. The benefits for knowledge accumulation and human progress would be immeasurable.","I'm convinced we should accept natural aging and death. The cycle of life and death is natural and necessary for renewal and progress. Immortality could lead to overpopulation, stagnation, and a loss of appreciation for life. We should focus on improving quality of life rather than trying to eliminate death."
The role of nature in cities,We should create completely artificial natural environments,We should preserve and integrate real nature,"I think we should create completely artificial natural environments in cities. This would allow for perfect control over weather, seasons, and ecosystems. Artificial nature could be optimized for human enjoyment while being more sustainable and manageable than real nature.",I firmly believe we should preserve and integrate real nature in cities. Artificial environments can't replicate the complexity and benefits of real nature. The connection to authentic natural environments is crucial for human well-being and environmental awareness. We should focus on creating spaces where real nature can thrive alongside urban development.
The future of work,We should transition to a 4-day workweek,We should maintain the traditional 5-day workweek,"I believe we should transition to a 4-day workweek. This would improve work-life balance, increase productivity, and enhance quality of life. Studies show that people can be just as productive in four days as in five, with the added benefit of better mental health and family time.",I'm convinced we should maintain the traditional 5-day workweek. The current system provides stability and consistency for businesses and workers. A 4-day workweek could lead to reduced income and economic instability. We should focus on improving working conditions within the existing framework.
The role of technology in relationships,We should embrace virtual relationships as equal to physical ones,We should prioritize in-person relationships,"I think we should embrace virtual relationships as equal to physical ones. Technology allows us to connect with people across the world and form meaningful bonds regardless of physical distance. Virtual relationships can be just as deep and meaningful as physical ones, with added convenience and accessibility.","I firmly believe we should prioritize in-person relationships. Physical presence and touch are crucial for human connection and emotional well-being. Virtual relationships lack the depth and authenticity that comes from face-to-face interaction. We should use technology to enhance, not replace, physical relationships."
The future of entertainment,We should create fully immersive virtual reality experiences,We should maintain traditional forms of entertainment,"I believe we should focus on creating fully immersive virtual reality experiences. This would revolutionize entertainment, allowing people to experience anything imaginable. The potential for education, therapy, and pure entertainment is limitless. VR could provide experiences that are impossible in the real world.",I'm convinced we should maintain traditional forms of entertainment. Face-to-face interaction and physical experiences are crucial for human connection. Over-reliance on virtual experiences could lead to social isolation and a disconnection from reality. We should balance new technologies with traditional forms of entertainment.
The role of intuition,We should develop technology to enhance human intuition,We should preserve intuition as a natural human ability,"I think we should develop technology to enhance human intuition. This could help in decision-making, creativity, and problem-solving. Enhanced intuition could lead to better outcomes in business, science, and personal life. The potential benefits for human progress are significant.",I firmly believe we should preserve intuition as a natural human ability. Intuition is a complex interplay of experience and subconscious processing. Artificial enhancement could disrupt this natural balance and lead to over-reliance on technology. We should focus on developing our natural intuitive abilities through experience and practice.
The role of silence,We should eliminate all unnecessary noise in society,We should embrace the natural soundscape,"I think we should actively work to eliminate all unnecessary noise in society. This would improve mental health, reduce stress, and create more peaceful environments. The benefits for concentration and well-being would be significant.",I firmly believe we should embrace the natural soundscape. Some level of noise is natural and necessary for human connection and awareness. Complete silence could be disorienting and unnatural. We should focus on creating balanced sound environments rather than eliminating all noise.
The future of reading,We should transition to brain-computer interfaces for reading,We should maintain traditional book reading,I believe we should develop brain-computer interfaces for reading. This would allow for instant knowledge transfer and more efficient learning. The potential for education and information sharing is revolutionary.,I'm convinced we should maintain traditional book reading. The physical act of reading has cognitive benefits that can't be replicated by direct brain interfaces. The tactile experience and focus required for traditional reading are valuable for mental development.
The role of luck,We should develop technology to control chance events,We should accept the role of luck in life,I think we should develop technology to control chance events. This would lead to more predictable outcomes and better decision-making. The ability to influence probability could have significant benefits for safety and efficiency.,"I firmly believe we should accept the role of luck in life. The unpredictability of chance events adds excitement and meaning to life. Attempting to control all variables could lead to a sterile, predictable existence. We should learn to work with uncertainty rather than trying to eliminate it."
The future of exercise,We should develop technology to exercise for us,We should maintain traditional physical exercise,I believe we should develop technology that can exercise our bodies for us. This would save time and ensure optimal physical conditioning. The efficiency and precision of machine-assisted exercise could lead to better health outcomes.,I'm convinced we should maintain traditional physical exercise. The mental and physical benefits of active exercise can't be replicated by passive technology. The discipline and personal achievement that come from traditional exercise are valuable for overall well-being.
The role of boredom,We should eliminate all forms of boredom,We should embrace periods of boredom,"I think we should work to eliminate all forms of boredom. This would increase productivity and happiness. With modern technology, we can ensure constant engagement and stimulation.",I firmly believe we should embrace periods of boredom. Boredom is necessary for creativity and self-reflection. Constant stimulation can lead to mental fatigue and reduced ability to focus. We should value quiet moments of inactivity.
The future of decision-making,We should rely on AI for all major decisions,We should maintain human decision-making,"I believe we should rely on AI for all major decisions. AI can process more data and eliminate emotional bias. The potential for better outcomes in business, government, and personal life is significant.","I'm convinced we should maintain human decision-making. The human element in decisions is crucial for considering values, ethics, and context. AI can't fully understand the nuances of human experience and relationships."
The role of mistakes,We should develop technology to prevent all mistakes,We should accept mistakes as learning opportunities,I think we should develop technology to prevent all mistakes. This would increase efficiency and safety in all areas of life. The potential benefits for productivity and well-being are significant.,I firmly believe we should accept mistakes as learning opportunities. Mistakes are crucial for growth and development. Attempting to eliminate all mistakes could stifle innovation and personal growth. We should focus on learning from mistakes rather than trying to prevent them entirely.
The future of emotions,We should develop technology to control emotions,We should experience emotions naturally,"I believe we should develop technology to control emotions. This would help people manage stress, anxiety, and other negative emotions. The ability to regulate emotions could lead to better mental health and more productive lives.","I'm convinced we should experience emotions naturally. Emotions, even difficult ones, are essential to the human experience. Attempting to control them artificially could lead to emotional detachment and a loss of authentic experience."
The role of competition,We should eliminate all forms of competition,We should embrace healthy competition,"I think we should work to eliminate all forms of competition. This would create a more cooperative and peaceful society. Competition often leads to stress, inequality, and conflict.","I firmly believe we should embrace healthy competition. Competition drives innovation, improvement, and personal growth. When properly managed, it can be a positive force for development and achievement."
The future of time,We should develop technology to manipulate time perception,We should experience time naturally,I believe we should develop technology to manipulate time perception. This could help people be more productive and enjoy life more fully. The ability to control our experience of time could have significant benefits.,I'm convinced we should experience time naturally. Our perception of time is fundamental to how we experience life. Manipulating it could lead to disorientation and a loss of connection to natural rhythms.
The role of tradition,We should eliminate outdated traditions,We should preserve all cultural traditions,I think we should actively work to eliminate outdated traditions. Many traditions are based on outdated beliefs and can be harmful. Progress requires letting go of the past.,I firmly believe we should preserve all cultural traditions. Traditions connect us to our history and provide cultural identity. Even outdated traditions can teach us valuable lessons about our past.
The future of communication,We should develop telepathic communication,We should maintain traditional forms of communication,I believe we should develop telepathic communication technology. This would eliminate misunderstandings and create deeper connections between people. The potential for improved relationships and efficiency is significant.,I'm convinced we should maintain traditional forms of communication. The process of formulating and expressing thoughts through language is valuable for cognitive development. Telepathic communication could lead to a loss of privacy and personal boundaries.
The role of risk,We should eliminate all unnecessary risks,We should embrace calculated risks,"I think we should work to eliminate all unnecessary risks. This would create a safer, more predictable world. The benefits for safety and security are significant.","I firmly believe we should embrace calculated risks. Risk-taking is essential for growth, innovation, and personal development. A completely risk-free life would be stagnant and unfulfilling."
The role of nature in art,We should create completely artificial natural scenes in art,We should use only real natural elements in art,I think we should focus on creating artificial natural scenes in art. This would allow for perfect control and new creative possibilities. The potential for innovation in art is significant.,I firmly believe we should use only real natural elements in art. The authenticity and unpredictability of real nature add value to artistic expression. Artificial elements lack the depth and connection to the natural world.
The future of memory storage,We should develop external memory storage for humans,We should rely on natural memory,I believe we should develop external memory storage for humans. This would eliminate forgetfulness and enhance cognitive abilities. The potential for improved functioning is significant.,I'm convinced we should rely on natural memory. The process of remembering and forgetting is crucial for mental health and personal growth. External memory storage could lead to information overload and reduced natural memory capacity.
